{
  "schemaVersion": 2,
  "status": "development",
  "scenario": "v0.5-voyager",
  "spherewright": {
    "repository": "Arcueid77/Spherewright",
    "submodulePath": "deps/Spherewright",
    "sourceSha": "e022d71a45aead056c1a0d0e8b470967534a2383",
    "releaseTag": null,
    "productVersion": "0.5.0"
  },
  "native": {
    "version": "0.10.35.29151",
    "assemblySha256": "EF314425DADE51F529F184F07BE136CD3C2660A6A81515603C7226FBE7AB1D8C"
  },
  "packages": {
    "manual": null,
    "thunderstore": null
  },
  "development": {
    "targetVersion": "0.5.0"
  },
  "installed": {
    "sourceSha": "c6603b0197706991994e9986fa774ed6c055aa70",
    "productVersion": "0.5.0",
    "releaseTag": null,
    "native": {
      "version": "0.10.35.29151",
      "assemblySha256": "EF314425DADE51F529F184F07BE136CD3C2660A6A81515603C7226FBE7AB1D8C"
    },
    "packages": {
      "manual": {
        "file": "Spherewright-0.5.0-win-x64.zip",
        "sha256": "779E05BBCDD22BC6C62B764914B575697F913E3A86144D6321F136BAA4A201CA",
        "size": 37169368
      },
      "thunderstore": {
        "file": "Spherewright-0.5.0-thunderstore.zip",
        "sha256": "8CA9581AEA928C426B51CD1C51B955A917D68549FE3F93805073342F23E891B9",
        "size": 32896981
      }
    },
    "evidence": "scenarios/v0.5-voyager/current-status.md",
    "verification": "disk_verified",
    "runtimeState": "not_running"
  },
  "acceptance": {
    "spec": "v0.4.0",
    "evidenceManifest": "releases/v0.4.0/manifests/evidence-manifest.json",
    "evidenceManifestSha256": "F191917B5279F2A4EA5BE3CF3A6F227801C3AB1CC42693C078531AD22CF62C50",
    "scope": "historical_reference",
    "sourceLock": "releases/v0.4.0/source-lock.json",
    "sourceLockSha256": "A2537F906A058593E05E1BF155AFE6D955F6B6E5110E3B658648E4B67CAF16C7"
  },
  "evidenceSource": {
    "repository": "AvaloNero/Spherewright",
    "sourceSha": "e7d5f7d8661092b7c8089710488c448f290638be"
  }
}